isbn,title,author,category,sub_category,description,publisher,year_of_publication,language,num_pages,img_link
B08RB2HRS1,Create GUI Applications with Python & Qt5 (PyQt5 Edition): The hands-on guide to making apps with Python,Dr Martin Fitzpatrick,Programming Languages,Computers & Technology,"Building desktop applications doesn't have to be difficult. Using Python & Qt5 you can create fully functional desktop apps in minutes. Starting from the very basics, this modern PyQt5 book takes you on a tour of the key features of PyQt5 you can use to build real-life applications.This is the 4th Edition of Create GUI Applications, updated for 2020 & PyQt5. Learn the fundamental building blocks of PyQt applications — Widgets, Layouts & Signals and learn how PyQt5 uses the event loop to handle and respond to user input. Design beautiful UIs with Qt Designer and customize the look and feel of your applications with Qt Style Sheets and custom widgets.Use Qt's MVC-like ModelViews framework to connect data sources to your widgets, including SQL databases, numpy and pandas data tables, to build-data driven application. Visualize data using matplotlib & PyQtGraph and connect with external data sources to build live dashboards. Learn how to use threads and processes to manage long-running tasks and communicate with external services. Parse data and visualize the output in logs and progress bars.The book includes usability and architectural tips to help you build maintainable and usable PyQt5 applications from the start. Finally, once your application is ready to be released, discover how to package it up into professional-quality installers, ready to ship.ContentsPyQt5 WidgetsSignals, slots & eventsGUI LayoutsToolbars & MenusPyQt5 DialogsWindowsQt DesignerPyQt5 Themes, Styles, Palettes & IconsModel View ArchitecturePyQt5 Table views with numpy & pandasDatabase, SQL modelsExtending PyQt5 SignalsSystem tray & MenusPyQt5 threading, thread pools & processesPlotting with PyQtGraph & matplotlibPackaging & distribution PyQt5 appsExample PyQt5 appsThe book includes665 pages of hands-on PyQt5 exercises211 code examples to experiment withSupport forum for all readersIncludes 4 example PyQt5 appsCompatible with Python 3.4+Code free to reuse in your own projectsMartin Fitzpatrick has been teaching and using PyQt for 8 years, helping thousands of developers bring their applications to life.Read more",Independently published ,2020,English,718,"https://images-na.ssl-images-amazon.com/images/I/41Njcwc0SyL._SY344_BO1,204,203,200_.jpg"
044651862X,The Celestine Prophecy: An Adventure,James Redfield,Genre Fiction,Literature & Fiction,"You have never read a book like this before -- a book that comes along once in a lifetime to change lives forever.In the rain forests of Peru, an ancient manuscript has been discovered. Within its pages are 9 key insights into life itself -- insights each human being is predicted to grasp sequentially; one insight, then another, as we move toward a completely spiritual culture on Earth. Drawing on ancient wisdom, it tells you how to make connections among the events happening in your life right now and lets you see what is going to happen to you in the years to come. The story it tells is a gripping one of adventure and discovery, but it is also a guidebook that has the power to crystallize your perceptions of why you are where you are in life and to direct your steps with a new energy and optimisim as you head into tomorrow.Read more",Warner Books 1st edition ,1993,English,246,"https://images-na.ssl-images-amazon.com/images/I/41JDkI7Cn7L._SY291_BO1,204,203,200_QL40_FMwebp_.jpg"
1593279280,"Python Crash Course, 2nd Edition: A Hands-On, Project-Based Introduction to Programming",Eric Matthes,Programming,Computers & Technology,"The second edition of the best-selling Python book in the world (over 1 million copies sold!). A fast-paced, no-nonsense guide to programming in Python. Updated and thoroughly revised to reflect the latest in Python code and practices.Python Crash Courseis the world's best-selling guide to the Python programming language. This fast-paced, thorough introduction to programming with Python will have you writing programs, solving problems, and making things that work in no time.In the first half of the book, you'll learn basic programming concepts, such as variables, lists, classes, and loops, and practice writing clean code with exercises for each topic. You'll also learn how to make your programs interactive and test your code safely before adding it to a project. In the second half, you'll put your new knowledge into practice with three substantial projects: a Space Invaders-inspired arcade game, a set of data visualizations with Python's handy libraries, and a simple web app you can deploy online.As you work through the book, you'll learn how to:•Use powerful Python libraries and tools, including Pygame, Matplotlib, Plotly, and Django•Make 2D games that respond to keypresses and mouse clicks, and that increase in difficulty•Use data to generate interactive visualizations•Create and customize web apps and deploy them safely online•Deal with mistakes and errors so you can solve your own programming problemsIf you've been thinking about digging into programming,Python Crash Coursewill get you writing real programs fast. Why wait any longer? Start your engines and code!Read more",No Starch Press 2nd edition ,2019,English,544,"https://images-na.ssl-images-amazon.com/images/I/51j89lmxnpL._SX218_BO1,204,203,200_QL40_FMwebp_.jpg"
0062315005,"The Alchemist, 25th Anniversary: A Fable About Following Your Dream",Paulo Coelho,Fantasy,Science Fiction & Fantasy,"Note: Item has rough Cut edges(Edges are cut improperly intentionally by the manufacturer)A special 25th anniversary edition of the extraordinary international bestseller, including a new Foreword by Paulo Coelho.Combining magic, mysticism, wisdom and wonder into an inspiring tale of self-discovery,The Alchemisthas become a modern classic, selling millions of copies around the world and transforming the lives of countless readers across generations.Paulo Coelho's masterpiece tells the mystical story of Santiago, an Andalusian shepherd boy who yearns to travel in search of a worldly treasure. His quest will lead him to riches far different—and far more satisfying—than he ever imagined. Santiago's journey teaches us about the essential wisdom of listening to our hearts, of recognizing opportunity and learning to read the omens strewn along life's path, and, most importantly, to follow our dreams.Read more",HarperOne 25th ed. edition ,2014,English,208,"https://images-na.ssl-images-amazon.com/images/I/51kcX5PpaZL._SY291_BO1,204,203,200_QL40_FMwebp_.jpg"
034543479X,A Widow for One Year,John Irving,Genre Fiction,Literature & Fiction,"Ruth Cole is a complex, often self-contradictory character--a ""difficult"" woman.  By no means is she conventionally ""nice,"" but she will never be forgotten.Ruth's story is told in three parts, each focusing on a crucial time in her life.  When we first meet her--on Long Island, in the summer of 1958--Ruth is only four.The second window into Ruth's life opens in the fall of 1990, when Ruth is an unmarried woman whose personal life is not nearly as successful as her literary career.  She distrusts her judgment in men, for good reason.A Widow for One Yearcloses in the autumn of 1995, when Ruth Cole is a forty-one-year-old widow and mother.  She's about to fall in love for the first time.Richly comic, as well as deeply disturbingA Widow for One Yearis a multilayered love story of astonishing emotional force.  Both ribald and erotic, it is also a brilliant novel about the passage of time and the relentlessness of grief.Read more",Fawcett Media tie-in edition ,2001,English,608,"https://images-na.ssl-images-amazon.com/images/I/51MY2gPQtBL._SY291_BO1,204,203,200_QL40_FMwebp_.jpg"
0446310786,To Kill a Mockingbird,Harper Lee,United States,Literature & Fiction,"The unforgettable novel of a childhood in a sleepy Southern town and the crisis of conscience that rocked it,To Kill A Mockingbirdbecame both an instant bestseller and a critical success when it was first published in 1960. It went on to win the Pulitzer Prize in 1961 and was later made into an Academy Award-winning film, also a classic.Compassionate, dramatic, and deeply moving,To Kill A Mockingbirdtakes readers to the roots of human behavior - to innocence and experience, kindness and cruelty, love and hatred, humor and pathos. Now with over 18 million copies in print and translated into forty languages, this regional story by a young Alabama woman claims universal appeal. Harper Lee always considered her book to be a simple love story. Today it is regarded as a masterpiece of American literature.Read more",Grand Central Publishing ,1988,English,384,"https://images-na.ssl-images-amazon.com/images/I/51N5qVjuKAL._SY291_BO1,204,203,200_QL40_FMwebp_.jpg"
0060930187,The Bell Jar: A Novel (Perennial Classics),Sylvia Plath,United States,Literature & Fiction,"A realistic and emotional novel about a woman battling mental illness and societal pressures written by the iconic American writer Sylvia Plath.“It is this perfectly wrought prose and the freshness of Plath’s voice inThe Bell Jarthat make this book enduring in its appeal.” —USA TodayThe Bell Jarchronicles the crack-up of Esther Greenwood: young, brilliant, beautiful, and enormously talented, but slowly going under—maybe for the last time. Sylvia Plath masterfully draws the reader into Esther’s breakdown with such intensity that Esther’s neurosis becomes completely understandable and even rational, as probable and accessible an experience as going to the movies. Such thorough exploration of the dark and harrowing corners of the psyche - and the profound collective loneliness that modern society has yet to find a solution for - is an extraordinary accomplishment, and has madeThe Bell Jara haunting American classic.This P.S. edition features extra insights into the book, including author interviews, recommended reading, and more.Read more",Harper Perennial Modern Classics Reprint edition ,2000,English,288,"https://images-na.ssl-images-amazon.com/images/I/418CDFx4dnL._SY291_BO1,204,203,200_QL40_FMwebp_.jpg"
0385486804,Into the Wild,Jon Krakauer,Americas,History,"Krakauer’s page-turning bestseller explores a famed missing person mystery while unraveling the larger riddles it holds: the profound pull of the American wilderness on our imagination; the allure of high-risk activities to young men of a certain cast of mind; the complex, charged bond between fathers and sons.""Terrifying... Eloquent... A heart-rending drama of human yearning."" —New York TimesIn April 1992 a young man from a well-to-do family hitchhiked to Alaska and walked alone into the wilderness north of Mt. McKinley. He had given $25,000 in savings to charity, abandoned his car and most of his possessions, burned all the cash in his wallet, and invented a new life for himself. Four months later, his decomposed body was found by a moose hunter. How Christopher Johnson McCandless came to die is the unforgettable story ofInto the Wild.Immediately after graduating from college in 1991, McCandless had roamed through the West and Southwest on a vision quest like those made by his heroes Jack London and John Muir. In the Mojave Desert he abandoned his car, stripped it of its license plates, and burned all of his cash. He would give himself a new name, Alexander Supertramp, and, unencumbered by money and belongings, he would be free to wallow in the raw, unfiltered experiences that nature presented. Craving a blank spot on the map, McCandless simply threw the maps away. Leaving behind his desperate parents and sister, he vanished into the wild.Jon Krakauer constructs a clarifying prism through which he reassembles the disquieting facts of McCandless's short life. Admitting an interst that borders on obsession, he searches for the clues to the drives and desires that propelled McCandless.When McCandless's innocent mistakes turn out to be irreversible and fatal, he becomes the stuff of tabloid headlines and is dismissed for his naiveté, pretensions, and hubris. He is said to have had a death wish but wanting to die is a very different thing from being compelled to look over the edge. Krakauer brings McCandless's uncompromising pilgrimage out of the shadows, and the peril, adversity, and renunciation sought by this enigmatic young man are illuminated with a rare understanding--and not an ounce of sentimentality. Mesmerizing, heartbreaking,Into the Wildis a tour de force. The power and luminosity of Jon Krakauer's stoytelling blaze through every page.Read more",Anchor Books 1st edition ,1997,English,240,"https://images-na.ssl-images-amazon.com/images/I/51rJVzn7lsL._SY291_BO1,204,203,200_QL40_FMwebp_.jpg"
0316666343,The Lovely Bones,Alice Sebold,Genre Fiction,Literature & Fiction,"This book is in very good condition, very little cover wearRead more","Little, Brown and Company 1st edition ",2002,English,328,"https://images-na.ssl-images-amazon.com/images/I/41tJCcMb4kL._SY291_BO1,204,203,200_QL40_FMwebp_.jpg"
067976402X,Snow Falling on Cedars,David Guterson,Movies,Humor & Entertainment,"NATIONAL BESTSELLER • PEN/Faulkner Award Winner •  A gripping, tragic, and densely atmospheric masterpiece of courtroom suspense—one that leaves us shaken and changed.""Haunting .... A whodunit complete with courtroom maneuvering and surprising turns of evidence and at the same time a mystery, something altogether richer and deeper."" —Los Angeles TimesSan Piedro Island, north of Puget Sound, is a place so isolated that no one who lives there can afford to make enemies.  But in 1954 a local fisherman is found suspiciously drowned, and a Japanese American named Kabuo Miyamoto is charged with his murder.In the course of the ensuing trial, it becomes clear that what is at stake is more than a man's guilt. For on San Pedro, memory grows as thickly as cedar trees and the fields of ripe strawberries—memories of a charmed love affair between a white boy and the Japanese girl who grew up to become Kabuo's wife; memories of land desired, paid for, and lost. Above all, San Piedro is haunted by the memory of what happened to its Japanese residents during World War II, when an entire community was sent into exile while its neighbors watched.Read more",Vintage 1st edition ,1995,English,460,"https://images-na.ssl-images-amazon.com/images/I/51BJFDqUw7L._SY291_BO1,204,203,200_QL40_FMwebp_.jpg"
0060915544,The Bean Trees,Barbara Kingsolver,Genre Fiction,Literature & Fiction,"Barbara Kingsolver's 1988 debut novel is a classic workof American fiction. Now a standard in college literature classes across thenation, and a book that appears in translation across the globe,The BeanTreesis not only a literary masterpiece but a popular triumphanarrative that readers worldwide have taken into their hearts. TheLos Angeles TimescallsThe Bean Treesthe work of a visionary. . . . It leaves you open-mouthed and smiling.Read more",Harper Perennial Reprint edition ,1989,English,240,"https://images-na.ssl-images-amazon.com/images/I/51z-glbKbFL._SY291_BO1,204,203,200_QL40_FMwebp_.jpg"
074932032X,Slow Waltz in Cedar Bend,Robert James Waller,Contemporary,Literature & Fiction,"A romance by the author of THE BRIDGES OF MADISON COUNTRY, telling of the sexual attraction at first sight between a middle-aged university professor and another professor's wife. When the woman disappears, the hero realises he is ready to travel the world in search of her.Read more",Mandarin ,1995,English,35,"https://images-na.ssl-images-amazon.com/images/I/416AKC34XBL._SY291_BO1,204,203,200_QL40_FMwebp_.jpg"
0452260116,Song of Solomon,Toni Morrison,United States,Literature & Fiction,"Macon Dead, Jr., called Milkman, son of the richest Negro in town, moves from childhood into early manhood, searching, among the disparate, mysterious members of his family, for his life and realityRead more",Plume Books ,1987,English,337,"https://images-na.ssl-images-amazon.com/images/I/71KQBKDD86L._SY291_BO1,204,203,200_QL40_FMwebp_.gif"
1569471428,"Breath, Eyes, Memory",Edwidge Danticat,United States,Literature & Fiction,"At the age of twelve, Sophie Caco is sent from her impoverished village of Croix-des-Rosets to New York, to be reunited with a mother she barely remembers. There she discovers secrets that no child should ever know, and a legacy of shame that can be healed only when she returns to Haiti--to the women who first reared her. What ensues is a passionate journey through a landscape charged with the supernatural and scarred by political violence, in a novel that bears witness to the traditions, suffering, and wisdom of an entire people.Read more",Soho Press 2nd edition ,2003,English,234,"https://images-na.ssl-images-amazon.com/images/I/51a32UZzJ3L._SY291_BO1,204,203,200_QL40_FMwebp_.jpg"
0316096199,Lucky,Alice Sebold,Community & Culture,Biographies & Memoirs,"In a memoir hailed for its searing candor and wit, Alice Sebold reveals how her life was utterly transformed when, as an eighteen-year-old college freshman, she was brutally raped and beaten in a park near campus. What propels this chronicle of her recovery is Sebold's indomitable spirit-as she struggles for understanding (""After telling the hard facts to anyone, from lover to friend, I have changed in their eyes""); as her dazed family and friends sometimes bungle their efforts to provide comfort and support; and as, ultimately, she triumphs, managing through grit and coincidence to help secure her attacker's arrest and conviction. In a narrative by turns disturbing, thrilling, and inspiring, Alice Sebold illuminates the experience of trauma victims even as she imparts wisdom profoundly hard-won: ""You save yourself or you remain unsaved.""Read more",Back Bay Books 1st edition ,2002,English,272,"https://images-na.ssl-images-amazon.com/images/I/41gWa8eF6eL._SY291_BO1,204,203,200_QL40_FMwebp_.jpg"
006000438X,The Death of Vishnu: A Novel,Manil Suri,United States,Literature & Fiction,"In a stirring new novel that incorporates elements of Hindu mythology, a Bombay apartment building becomes a metaphor for the divisions and cultural clashes of modern India, as Vishnu, the resident handyman, lies dying on the staircase while his neighbors argue over who will pay for an ambulance. A first novel. Reprint.Read more",Harper Perennial 1st edition ,2002,English,301,"https://images-na.ssl-images-amazon.com/images/I/51dzKL6qNnL._SY291_BO1,204,203,200_QL40_FMwebp_.jpg"
0060929871,Brave New World,Aldous Huxley,United States,Literature & Fiction,"A fantasy of the future that sheds a blazing critical light on the present--considered to be Aldous Huxley's most enduring masterpiece.""Mr. Huxley is eloquent in his declaration of an artist's faith in man, and it is his eloquence, bitter in attack, noble in defense, that, when one has closed the book, one remembers.""--Saturday Review of Literature""A Fantastic racy narrative, full of much excellent satire and literary horseplay.""--Forum""It is as sparkling, provocative, as brilliant, in the appropriate sense, as impressive ads the day it was published. This is in part because its prophetic voice has remained surprisingly contemporary, both in its particular forecasts and in its general tone of semiserious alarm. But it is much more because the book succeeds as a work of art...This is surely Huxley's best book.""--Martin GreenRead more",Harper Perennial Modern Classics ,1998,English,268,"https://images-na.ssl-images-amazon.com/images/I/41JP2Y4awLL._SY291_BO1,204,203,200_QL40_FMwebp_.jpg"
0316899992,"River, Cross My Heart",Breena Clarke,United States,Literature & Fiction,"After the drowning death of their daughter in the Potomac River, a family leaves their rural North Carolina world in search of a better life among friends and relatives in Georgetown, as they grapple with their loss and struggle to move forwardRead more",Little Brown & Co 1st edition ,1999,English,245,"https://images-na.ssl-images-amazon.com/images/I/4174PBG9JTL._SY291_BO1,204,203,200_QL40_FMwebp_.jpg"
0345420748,While I Was Gone,Sue Miller,Genre Fiction,Literature & Fiction,"“MILLER WEAVES HER THEMES OF SECRECY, BETRAYAL AND FORGIVENESS INTO A NARRATIVE THAT SHINES.”–Time“FASCINATING . . . Despite having a loving husband, three vivacious daughters, a beautiful home in rural Massachusetts, and satisfaction in her work, Jo Becker’s mind is invaded by a persistent restlessness. Then, an old roommate reappears to bring back Jo’s memories of her early 20s. . . . Her obsession with that period of her life and with the crime that concluded it eventually estrange Jo from everything she holds dear, causing her to tell lie after lie as she is pulled closer to this man from her past–and to a horrible secret.”–Milwaukee Journal-SentinelRead more",Ballantine Books Reprint edition ,2002,English,352,"https://images-na.ssl-images-amazon.com/images/I/51+dcg3RKWL._SY344_BO1,204,203,200_.jpg"
0452282195,The Bluest Eye (Oprah's Book Club),Toni Morrison,Literary,Literature & Fiction,The story of Pecola Breedlove profiles an eleven-year-old Black girl growing up in an America that values blue-eyed blondes and the tragedy that results from her longing to be accepted.Read more,Plume ,2000,English,224,"https://images-na.ssl-images-amazon.com/images/I/41KZ2EEM0YL._SY291_BO1,204,203,200_QL40_FMwebp_.jpg"
0671510053,The Shipping News,E. Annie Proulx,Genre Fiction,Literature & Fiction,"Winner of the Pulitzer Prize, Annie Proulx’sThe Shipping Newsis a vigorous, darkly comic, and at times magical portrait of the contemporary North American family.Quoyle, a third-rate newspaper hack, with a “head shaped like a crenshaw, no neck, reddish hair...features as bunched as kissed fingertips,” is wrenched violently out of his workaday life when his two-timing wife meets her just desserts. An aunt convinces Quoyle and his two emotionally disturbed daughters to return with her to the starkly beautiful coastal landscape of their ancestral home in Newfoundland. Here, on desolate Quoyle’s Point, in a house empty except for a few mementos of the family’s unsavory past, the battered members of three generations try to cobble up new lives.Newfoundland is a country of coast and cove where the mercury rarely rises above seventy degrees, the local culinary delicacy is cod cheeks, and it’s easier to travel by boat and snowmobile than on anything with wheels. In this harsh place of cruel storms, a collapsing fishery, and chronic unemployment, the aunt sets up as a yacht upholsterer in nearby Killick-Claw, and Quoyle finds a job reporting the shipping news for the local weekly, theGammy Bird(a paper that specializes in sexual-abuse stories and grisly photos of car accidents).As the long winter closes its jaws of ice, each of the Quoyles confronts private demons, reels from catastrophe to minor triumph—in the company of the obsequious Mavis Bangs; Diddy Shovel the strongman; drowned Herald Prowse; cane-twirling Beety; Nutbeem, who steals foreign news from the radio; a demented cousin the aunt refuses to recognize; the much-zippered Alvin Yark; silent Wavey; and old Billy Pretty, with his bag of secrets. By the time of the spring storms Quoyle has learned how to gut cod, to escape from a pickle jar, and to tie a true lover’s knot.Read more",Scribner 1st edition ,1994,English,352,"https://images-na.ssl-images-amazon.com/images/I/41zfMTbOIML._SY291_BO1,204,203,200_QL40_FMwebp_.jpg"
014028009X,Bridget Jones's Diary: A Novel,Helen Fielding,Dramas & Plays,Literature & Fiction,"USA Today's top 100 books to read while stuck at home social distancingThe iconic #1 bestseller by Helen Fielding; Bridget Jones is now the inspiration for the September 2016 Working Title film release ofBridget Jones's Baby, starring Renee Zellweger, Colin Firth, Patrick Dempsey and Emma Thompson.Bridget Jones's Diaryis the devastatingly self-aware, laugh-out-loud account of a year in the life of a thirty-something Singleton on a permanent doomed quest for self-improvement. Caught between the joys of Singleton fun, and the fear of dying alone and being found three weeks later half eaten by an Alsatian; tortured by Smug Married friends asking, ""How's your love life?"" with lascivious, yet patronizing leers, Bridget resolves to: reduce the circumference of each thigh by 1.5 inches, visit the gym three times a week not just to buy a sandwich, form a functional relationship with a responsible adult and learn to program the VCR. With a blend of flighty charm, existential gloom, and endearing self-deprecation,Bridget Jones's Diaryhas touched a raw nerve with millions of readers the world round. Read it and laugh—before you cry, ""Bridget Jones is me!""Read more",Penguin Books ,1999,English,288,"https://images-na.ssl-images-amazon.com/images/I/51M-OGgIffL._SY291_BO1,204,203,200_QL40_FMwebp_.jpg"
0446677450,Rich Dad Poor Dad: What the Rich Teach Their Kids About Money-That the Poor and the Middle Class Do Not!,Robert T. Kiyosaki,Investing,Business & Money,"“Rich Dad, Poor Dad” chronicles the story of two dads, the author’s own father, who was the superintendent of education in Hawaii and who ended up dying penniless, and the author's best friend’s father (and Kiyosaki’s mentor growing up), who dropped out of school at age 13 and went on to become one of the wealthiest men in Hawaii. Kiyosaki uses the story of these two men and their varying financial strategies to illustrate the need for a new financial paradigm in order to achieve financial success in the new millennium.Read more",Business Plus 1st edition ,2000,English,272,"https://images-na.ssl-images-amazon.com/images/I/51fAOarGB-L._SY344_BO1,204,203,200_.jpg"
