isbn,title,author,category,sub_category,description,publisher,year_of_publication,language,num_pages,img_link
0385494785,Into Thin Air: A Personal Account of the Mt. Everest Disaster,Jon Krakauer,Professionals & Academics,Biographies & Memoirs,"#1 NATIONAL BESTSELLER•""A harrowing tale of the perils of high-altitude climbing, a story of bad luck and worse judgment and of heartbreaking heroism."" —PEOPLEA bank of clouds was assembling on the not-so-distant horizon, but journalist-mountaineer Jon Krakauer, standing on the summit of Mt. Everest, saw nothing that ""suggested that a murderous storm was bearing down."" He was wrong. The storm, which claimed five lives and left countless more--including Krakauer's--in guilt-ridden disarray, would also provide the impetus forInto Thin Air, Krakauer's epic account of the May 1996 disaster.By writingInto Thin Air, Krakauer may have hoped to exorcise some of his own demons and lay to rest some of the painful questions that still surround the event. He takes great pains to provide a balanced picture of the people and events he witnessed and gives due credit to the tireless and dedicated Sherpas. He also avoids blasting easy targets such as Sandy Pittman, the wealthy socialite who brought an espresso maker along on the expedition. Krakauer's highly personal inquiry into the catastrophe provides a great deal of insight into what went wrong. But for Krakauer himself, further interviews and investigations only lead him to the conclusion that his perceived failures were directly responsible for a fellow climber's death. Clearly, Krakauer remains haunted by the disaster, and although he relates a number of incidents in which he acted selflessly and even heroically, he seems unable to view those instances objectively. In the end, despite his evenhanded and even generous assessment of others' actions, he reserves a full measure of vitriol for himself.This updated trade paperback edition ofInto Thin Airincludes an extensive new postscript that sheds fascinating light on the acrimonious debate that flared between Krakauer and Everest guide Anatoli Boukreev in the wake of the tragedy.  ""I have no doubt that Boukreev's intentions were good on summit day,"" writes Krakauer in the postscript, dated August 1999. ""What disturbs me, though, was Boukreev's refusal to acknowledge the possibility that he made even a single poor decision. Never did he indicate that perhaps it wasn't the best choice to climb without gas or go down ahead of his clients."" As usual, Krakauer supports his points with dogged research and a good dose of humility. But rather than continue the heated discourse that has raged sinceInto Thin Air's denouncement of guide Boukreev, Krakauer's tone is conciliatory; he points most of his criticism at G. Weston De Walt, who coauthoredThe Climb, Boukreev's version of events. And in a touching conclusion, Krakauer recounts his last conversation with the late Boukreev, in which the two weathered climbers agreed to disagree about certain points. Krakauer had great hopes to patch things up with Boukreev, but the Russian later died in an avalanche on another Himalayan peak, Annapurna I.In 1999, Krakauer received an Academy Award in Literature from the American Academy of Arts and Letters--a prestigious prize intended ""to honor writers of exceptional accomplishment.""  According to the Academy's citation, ""Krakauer combines the tenacity and courage of the finest tradition of investigative journalism with the stylish subtlety and profound insight of the born writer.  His account of an ascent of Mount Everest has led to a general reevaluation of climbing and of the commercialization of what was once a romantic, solitary sport; while his account of the life and death of Christopher McCandless, who died of starvation after challenging the Alaskan wilderness, delves even more deeply and disturbingly into the fascination of nature and the devastating effects of its lure on a young and curious mind.""Read more",Anchor Reprint edition ,1999,English,332,"https://images-na.ssl-images-amazon.com/images/I/512t9z6JLLL._SY291_BO1,204,203,200_QL40_FMwebp_.jpg"
0140293248,The Girls' Guide to Hunting and Fishing,Melissa Bank,Genre Fiction,Literature & Fiction,"TheNew York Timesbestselling classic of a young woman’s journey in work, love, and life“In this swinging, funny, and tender study of contemporary relationships, Bank refutes once and for all the popular notions of neurotic thirtysomething women.”—Entertainment Weekly“Truly poignant.” —TimeGenerous-hearted and wickedly insightful,The Girls’ Guide to Hunting and Fishingmaps the progress of Jane Rosenal as she sets out on a personal and spirited expedition through the perilous terrain of sex, love, relationships, and the treacherous waters of the workplace. Soon Jane is swept off her feet by an older man and into a Fitzgeraldesque whirl of cocktail parties, country houses, and rules that were made to be broken, but comes to realize that it’s a world where the stakes are much too high for comfort. With an unforgettable comic touch, Bank skillfully teases out universal issues, puts a clever new spin on the mating dance, and captures in perfect pitch what it’s like to come of age as a young woman.Read more",Penguin Books Reissue edition ,2000,English,288,"https://images-na.ssl-images-amazon.com/images/I/41FH5nR6GOL._SY291_BO1,204,203,200_QL40_FMwebp_.jpg"
0142002267,"Word Freak: Heartbreak, Triumph, Genius, and Obsession in the World of Competitive Scrabble Players",Stefan Fatsis,Puzzles & Games,Humor & Entertainment,"Scrabble may be truly called America's game. But for every group of ""living-room players"" there is someone who is ""at one with the board."" InWord Freak, Stefan Fatsis introduces readers to those few, exploring the underground world of colorful characters for which the Scrabble game is life-playing competitively in tournaments across the country. It is also the story of how the Scrabble game was invented by an unemployed architect during the Great Depression and how it has grown into the hugely successful, challenging, and beloved game it is today. Along the way, Fatsis chronicles his own obsession with the game and his development as a player from novice to expert. More than a book about hardcore Scrabble players,Word Freakis also an examination of notions of brilliance, memory, language, competition, and the mind that celebrates the uncanny creative powers in us all.A Book Sense 76 pick.Read more",Penguin Books 20th ed. edition ,2002,English,416,"https://images-na.ssl-images-amazon.com/images/I/51-+h+c72DL._SY344_BO1,204,203,200_.jpg"
0553572997,The Alienist,Caleb Carr,Genre Fiction,Literature & Fiction,"The year is 1896, the place, New York City. On a cold March nightNew York Timesreporter John Schuyler Moore is summoned to the East River by his friend and former Harvard classmate Dr. Laszlo Kreizler, a psychologist, or ""alienist."" On the unfinished Williamsburg Bridge, they view the horribly mutilated body of an adolescent boy, a prostitute from one of Manhattan's infamous brothels.The newly appointed police commissioner, Theodore Roosevelt, in a highly unorthodox move, enlists the two men in the murder investigation, counting on the reserved Kreizler's intellect and Moore's knowledge of New York's vast criminal underworld. They are joined by Sara Howard, a brave and determined woman who works as a secretary in the police department. Laboring in secret (for alienists, and the emerging discipline of psychology, are viewed by the public with skepticism at best), the unlikely team embarks on what is a revolutionary effort in criminology-- amassing a psychological profile of the man they're looking for based on the details of his crimes. Their dangerous quest takes them into the tortured past and twisted mind of a murderer who has killed before. and will kill again before the hunt is over.Fast-paced and gripping, infused with a historian's exactitude,The Alienistconjures up the Gilded Age and its untarnished underside: verminous tenements and opulent mansions, corrupt cops and flamboyant gangsters, shining opera houses and seamy gin mills. Here is a New York during an age when questioning society's belief that all killers are born, not made, could have unexpected and mortal consequences.Read more",Bantam ,1995,English,608,"https://images-na.ssl-images-amazon.com/images/I/51WD6H9WDXL._SY291_BO1,204,203,200_QL40_FMwebp_.jpg"
0345370775,Jurassic Park: A Novel,Michael Crichton,Action & Adventure,Literature & Fiction,"An astonishing technique for recovering and cloning dinosaur DNA has been discovered. Creatures once extinct now roam Jurassic Park, soon-to-be opened as a theme park. Until something goes wrong...and science proves a dangerous toy....""Wonderful...Powerful.""THE WASHINGTON POST BOOK WORLDRead more",Ballantine Books ,1991,English,416,"https://images-na.ssl-images-amazon.com/images/I/51XuIErIiIL._SY291_BO1,204,203,200_QL40_FMwebp_.jpg"
0345380371,Rising Sun,Michael Crichton,Thrillers & Suspense,"Mystery, Thriller & Suspense","During the grand opening celebration of the new American headquarters of an immense Japanese conglomerate, the dead body of a beautiful woman is found. The investigation begins, and immediately becomes a headlong chase through a twisting maze of industrial intrigue and a violent business battle that takes no prisoners.Read more",Ballantine Books PF edition ,1992,English,416,"https://images-na.ssl-images-amazon.com/images/I/51nAbeJUVIL._SY291_BO1,204,203,200_QL40_FMwebp_.jpg"
0671027360,Angels & Demons,Dan Brown,Thrillers & Suspense,"Mystery, Thriller & Suspense","An ancient secret brotherhood.A devastating new weapon of destruction.An unthinkable target.World-renowned Harvard symbologist Robert Langdon is summoned to a Swiss research facility to analyze a cryptic symbol seared into the chest of a murdered physicist. What he discovers is unimaginable: a deadly vendetta against the Catholic Church by a centuries-old underground organization -- the Illuminati. Desperate to save the Vatican from a powerful time bomb, Langdon joins forces in Rome with the beautiful and mysterious scientist Vittoria Vetra. Together they embark on a frantic hunt through sealed crypts, dangerous catacombs, deserted cathedrals, and the most secretive vault on earth...the long-forgotten Illuminati lair.Read more",Pocket Star Books Reissue edition ,2001,English,572,"https://images-na.ssl-images-amazon.com/images/I/51MY9Q410WL._SY291_BO1,204,203,200_QL40_FMwebp_.jpg"
0060392452,Stupid White Men ...And Other Sorry Excuses for the State of the Nation!,Michael Moore,Politics & Government,Politics & Social Sciences,"Remember when everything was looking up? When the government was running at a surplus, pollution was disappearing, peace was breaking out in the Middle East and Northern Ireland, and the Bridge to the 21st century was strung with high–speed Internet cable and paved with 401K gold?Well, so much for the future. Michael Moore, the award–winning provocateur behindRoger & Meand the bestsellerDownsize This!, now returns to size up the new century – and that big, ugly special–interest group that's laying waste to the world as we know it: stupid white men. Whether he's calling for United Nations action to overthrow the Bush Family Junta, calling on African–Americans to place 'whites only' signs over the entrances of unfriendly businesses, or praying that Jesse Helms will get kissed by a man,Stupid White Menis Mike's Manifesto on Malfeasance and Mediocrity. So if you're feeling the same way and you're wondering what's going to give out first – the economy, Dick Cheney's pacemaker, or your new VW Beetle – here's the book for you.Read more",Harper 1st edition ,2002,English,304,"https://images-na.ssl-images-amazon.com/images/I/517ZiOJPJDL._SY291_BO1,204,203,200_QL40_FMwebp_.jpg"
0312291639,The Nanny Diaries: A Novel,Emma McLaughlin,Humor & Satire,Literature & Fiction,"Wanted:One young woman to take care of four-year-old boy. Must be cheerful, enthusiastic and selfless--bordering on masochistic. Must relish sixteen-hour shifts with a deliberately nap-deprived preschooler. Must love getting thrown up on, literally and figuratively, by everyone in his family. Must enjoy the delicious anticipation of ridiculously erratic pay. Mostly, must love being treated like fungus found growing out of employers Hermès bag. Those who take it personally need not apply.Whowouldn'twant this job? Struggling to graduate from NYU and afford her microscopic studio apartment, Nanny takes a position caring for the only son of the wealthy X family. She rapidly learns the insane amount of juggling involved to ensure that a Park Avenue wife who doesn't work, cook, clean, or raise her own child has a smooth day.When the Xs' marriage begins to disintegrate, Nanny ends up involved way beyond the bounds of human decency or good taste. Her tenure with the X family becomes a nearly impossible mission to maintain the mental health of their four-year-old, her own integrity and, most importantly, her sense of humor. Over nine tense months, Mrs. X and Nanny perform the age-old dance of decorum and power as they test the limits of modern-day servitude.Written by two former nannies,The Nanny Diariesdeftly punctures the glamour of Manhattan's upper class.Read more",St. Martin's Griffin First edition ,2003,English,320,"https://images-na.ssl-images-amazon.com/images/I/41Kiib8RbXL._SY291_BO1,204,203,200_QL40_FMwebp_.jpg"
0679751521,Midnight in the Garden of Good and Evil: A Savannah Story,John Berendt,Americas,History,"“Elegant and wicked.... [This] might be the first true-crime book that makes the reader want to book a bed and breakfast for an extended weekend at the scene of the crime."" —The New York Times Book ReviewShots rang out in Savannah's grandest mansion in the misty,early morning hours of May 2, 1981. Was it murder or self-defense? For nearly a decade, the shooting and its aftermath reverberated throughout this hauntingly beautiful city of moss-hung oaks and shaded squares. John Berendt's sharply observed, suspenseful, and witty narrative reads like a thoroughly engrossing novel, and yet it is a work of nonfiction. Berendt skillfully interweaves a hugely entertaining first-person account of life in this isolated remnant of the Old South with the unpredictable twists and turns of a landmark murder case.It is a spellbinding story peopled by a gallery of remarkable characters: the well-bred society ladies of the Married Woman's Card Club; the turbulent young redneck gigolo; the hapless recluse who owns a bottle of poison so powerful it could kill every man, woman, and child in Savannah; the aging and profane Southern belle who is the ""soul of pampered self-absorption""; the uproariously funny black drag queen; the acerbic and arrogant antiques dealer; the sweet-talking, piano-playing con artist; young blacks dancing the minuet at the black debutante ball; and Minerva, the voodoo priestess who works her magic in the graveyard at midnight. These and other Savannahians act as a Greek chorus, with Berendt revealing the alliances, hostilities, and intrigues that thrive in a town where everyone knows everyone else.Midnight in the Garden of Good and Evilis a sublime and seductive reading experience. Brilliantly conceived and masterfully written, this enormously engaging portrait of a most beguiling Southern city has become a modern classic.Read more",Vintage Reprint edition ,1999,English,400,"https://images-na.ssl-images-amazon.com/images/I/61JjAhO8Q+L._SY344_BO1,204,203,200_.jpg"
0804114986,The Bonesetter's Daughter: A Novel,Amy Tan,Genre Fiction,Literature & Fiction,"“The Bonesetter’s Daughterdramatically chronicles the tortured, devoted relationship between LuLing Young and her daughter Ruth. . . . A strong novel, filled with idiosyncratic, sympathetic characters, haunting images, historical complexity, significant contemporary themes, and suspenseful mystery.”–Los Angeles Times“TAN AT HER BEST . . . Rich and hauntingly forlorn . . . The writing is so exacting and unique in its detail.”–San Francisco Chronicle“For Tan, the true keeper of memory is language, and so the novel is layered with stories that have been written down–by mothers for their daughters, passing along secrets that cannot be said out loud but must not be forgotten.”–TheNew York Times Book Review“AMY TAN [HAS] DONE IT AGAIN. . . .The Bonesetter’s Daughtertells a compelling tale of family relationships; it layers and stirs themes of secrets, ambiguous meanings, cultural complexity and self-identity; and it resonates with metaphor and symbol.”–The Denver PostRead more",Ballantine Books Reissue edition ,2002,English,416,"https://images-na.ssl-images-amazon.com/images/I/51IeIXgANRL._SY291_BO1,204,203,200_QL40_FMwebp_.jpg"
0446670251,The Virgin Suicides,Jeffrey Eugenides,Genre Fiction,Literature & Fiction,"Juxtaposing the most common and the most gothic, the humorous and the tragic, author Jeffrey Eugenides creates a vivid and compelling portrait of youth and lost innocence. He takes us back to the elm-lined streets of suburbia in the seventies, and introduces us to the men whose lives have been forever changed by their fierce, awkward obsession with five doomed sisters: brainy Therese, fastidious Mary, ascetic Bonnie, libertine Lux, and pale, saintly Cecilia, whose spectacular demise inaugurates ""the year of the suicides."" This is the debut novel that caused a sensation and won immediate acclaim from the critics-a tender, wickedly funny tale of love and terror, sex and suicide, memory and imagination.Read more",Grand Central Publishing Reprint edition ,1994,English,256,"https://images-na.ssl-images-amazon.com/images/I/41AL4-Yt+HL._SY344_BO1,204,203,200_.jpg"
0375726403,Empire Falls,Richard Russo,Humor,Humor & Entertainment,"Winner of the Pulitzer Prize“Russo writes with a warm, vibrant humanity.... A stirring mix of poignancy, drama and comedy.”—The Washington PostWelcome to Empire Falls, a blue-collar town full of abandoned mills whose citizens surround themselves with the comforts and feuds provided by lifelong friends and neighbors and who find humor and hope in the most unlikely places, in this Pulitzer Prize-winning novel by Richard Russo.Miles Roby has been slinging burgers at the Empire Grill for 20 years, a job that cost him his college education and much of his self-respect. What keeps him there? It could be his bright, sensitive daughter Tick, who needs all his help surviving the local high school. Or maybe it’s Janine, Miles’ soon-to-be ex-wife, who’s taken up with a noxiously vain health-club proprietor. Or perhaps it’s the imperious Francine Whiting, who owns everything in town–and seems to believe that “everything” includes Miles himself. InEmpire FallsRichard Russo delves deep into the blue-collar heart of America in a work that overflows with hilarity, heartache, and grace.Read more",Vintage ,2002,English,483,"https://images-na.ssl-images-amazon.com/images/I/51I2k5d1mML._SY291_BO1,204,203,200_QL40_FMwebp_.jpg"
0312243022,"The Hours: A Novel (Picador Modern Classics, 1)",Michael Cunningham,United States,Literature & Fiction,"The Pulitzer Prize-winning novel that became a motion picture starring Meryl Streep, Julianne Moore, and Nicole Kidman, directed by Stephen Daldry from a screenplay by David HareInThe Hours, Michael Cunningham, widely praised as one of the most gifted writers of his generation, draws inventively on the life and work of Virginia Woolf to tell the story of a group of contemporary characters struggling with the conflicting claims of love and inheritance, hope and despair. The narrative of Woolf's last days before her suicide early in World War II counterpoints the fictional stories of Samuel, a famous poet whose life has been shadowed by his talented and troubled mother, and his lifelong friend Clarissa, who strives to forge a balanced and rewarding life in spite of the demands of friends, lovers, and family.Passionate, profound, and deeply moving, this is Cunningham's most remarkable achievement to date.Read more",Picador First edition ,2000,English,240,"https://images-na.ssl-images-amazon.com/images/I/41Bd73xzF+L._SY344_BO1,204,203,200_.jpg"
0375727345,House of Sand and Fog (Oprah's Book Club) (Vintage Contemporaries),Andre Dubus III,United States,Literature & Fiction,"NOW A MAJOR MOTION PICTUREIn this riveting novel of almost unbearable suspense, three fragile yet determined people become dangerously entangled in a relentlessly escalating crisis. Colonel Behrani, once a wealthy man in Iran, is now a struggling immigrant willing to bet everything he has to resotre his family's dignity. Kathy Nicolo is a troubled young woman whose house is all she has left, and who refuses to let her hard-won stability slip away from her. Sheriff Lester Burdon, a married man who finds himself falling in love with Kathy, becomes obsessed with helping her fight for justice.Drawn by their competing desires to the same small house in the California hills and doomed by their tragic inability to understand one another, the three converge in an explosive collision course. Combining unadorned realism with profound empathy,House of Sand and Fogmarks the arrival of a major new voice in American fiction.Read more",Vintage Trade edition ,2000,English,365,"https://images-na.ssl-images-amazon.com/images/I/415zMnaBRgL._SY291_BO1,204,203,200_QL40_FMwebp_.jpg"
014023313X,The Stone Diaries,Carol Diggory Shields,Genre Fiction,Literature & Fiction,"From her birth in rural Manitoba, to her journey with her father to southern Indiana, to her years as a wife, mother, and widow, to her old age, Daisy Stone Goodwill struggles to find a place for herself in her own lifeRead more",Penguin Books ,1995,English,400,"https://images-na.ssl-images-amazon.com/images/I/51QoXG3VeNL._SY291_BO1,204,203,200_QL40_FMwebp_.jpg"
0385474016,Like Water For Chocolate,Laura Esquivel,Contemporary,Literature & Fiction,"Despite the fact that she has fallen in love with a young man, Tita, the youngest of three daughters born to a tyrannical rancher, must obey tradition and remain single and at home to care for her mother. Reprint. Movie tie-in.Read more",Anchor Books ,1994,English,241,"https://images-na.ssl-images-amazon.com/images/I/519u0Ceo2fL._SY291_BO1,204,203,200_QL40_FMwebp_.jpg"
0375727965,The Brethren,John Grisham,Thrillers & Suspense,"Mystery, Thriller & Suspense","They call themselves The Brethren: three disgraced former judges doing time in a Florida federal prison.  One was sent down for tax evasion.  Another, for skimming bingo profits.  The third, for a career-ending drunken joyride.  Meeting daily in the prison library, taking exercise walks in their boxer shorts, these judges-turned-felons can reminisce about old court cases, dispense a little jailhouse justice, and contemplate where their lives went wrong.Or they can use their time in prison to get very rich- very fast.And so they sit, sprawled in the prison library, furiously writing letters, fine-tuning a wickedly brilliant extortion scam....while events outside their prison walls begin to erupt.  A bizarre presidential election is holding the nation in its grip- and a powerful government figure is pulling some very hidden strings.  For the Brethren, the timing couldn't be better.Because they've just found the perfect victim....Read more",Random House Large Print Large Print edition ,2000,English,528,"https://images-na.ssl-images-amazon.com/images/I/51QF2PWJBKL._SY291_BO1,204,203,200_QL40_FMwebp_.jpg"
031242227X,Running with Scissors: A Memoir,Augusten Burroughs,Politics & Government,Politics & Social Sciences,"The #1New York TimesBestsellerAnEntertainment WeeklyTop Ten Book of the YearNow a Major Motion PictureRunning with Scissorsis the true story of a boy whose mother (a poet with delusions of Anne Sexton) gave him away to be raised by her unorthodox psychiatrist who bore a striking resemblance to Santa Claus. So at the age of twelve, Burroughs found himself amidst Victorian squalor living with the doctor's bizarre family, and befriending a pedophile who resided in the backyard shed. The story of an outlaw childhood where rules were unheard of, and the Christmas tree stayed up all year round, where Valium was consumed like candy, and if things got dull an electroshock- therapy machine could provide entertainment. The funny, harrowing and bestselling account of an ordinary boy's survival under the most extraordinary circumstances.Running with Scissors AcknowledgmentsGratitude doesn't begin to describe it: Jennifer Enderlin, Christopher Schelling, John Murphy, Gregg Sullivan, Kim Cardascia, Michael Storrings, and everyone at St. Martin's Press. Thank you: Lawrence David, Suzanne Finnamore, Robert Rodi, Bret Easton Ellis, Jon Pepoon, Lee Lodes, Jeff Soares, Kevin Weidenbacher, Lynda Pearson, Lona Walburn, Lori Greenburg, John DePretis, and Sheila Cobb. I would also like to express my appreciation to my mother and father for, no matter how inadvertently, giving me such a memorable childhood. Additionally, I would like to thank the real-life members of the family portrayed in this book for taking me into their home and accepting me as one of their own. I recognize that their memories of the events described in this book are different than my own. They are each fine, decent, and hard-working people. The book was not intended to hurt the family. Both my publisher and I regret any unintentional harm resulting from the publishing and marketing of Running with Scissors. Most of all, I would like to thank my brother for demonstrating, by example, the importance of being wholly unique.Read more",Picador Reprint edition ,2003,English,320,"https://images-na.ssl-images-amazon.com/images/I/51mzqTVGgfL._SY291_BO1,204,203,200_QL40_FMwebp_.jpg"
