isbn,title,author,category,sub_category,description,publisher,year_of_publication,language,num_pages,img_link
0451172817,Needful Things: The Last Castle Rock Story,Stephen King,Genre Fiction,Literature & Fiction,"YOU’VE BEEN HERE BEFORE….A wonderful new store has opened in the little town of Castle Rock, Maine. Whatever your heart’s secret desire—sexual pleasure, wealth, power, or even more precious things—it’s for sale. And even though every item has a nerve-shattering price, the owner is always ready to make a bargain.In this chilling novel by one of the most potent imaginations of our time, evil is on a shopping spree and out to scare you witless.Read more",Signet Book ,1992,English,731,"https://images-na.ssl-images-amazon.com/images/I/511FXtkZrBL._SY291_BO1,204,203,200_QL40_FMwebp_.jpg"
0425124347,The Bad Place,Dean Koontz,Genre Fiction,Literature & Fiction,A fast-paced thriller by the best-selling author ofDark Rivers of the HeartandEyes of Darknesspromises fans a roller-coaster ride of stomach-gripping suspense. Reissue.Read more,Berkley First Edition ,1990,English,432,"https://images-na.ssl-images-amazon.com/images/I/51mqfEKRD6L._SY291_BO1,204,203,200_QL40_FMwebp_.jpg"
0440222842,Five Days in Paris: A Novel,Danielle Steel,Genre Fiction,Literature & Fiction,"As president of a major pharmaceutical empire, Peter Haskell has everything. Power, position, a career and a family, which mean everything to him, and for which he has sacrificed a great deal. Compromise has been key in Peter Haskell's life, and integrity is the base on which he lives.Olivia Thatcher is the wife of a famous senator. She has given to her husband's ambitions and career until her soul is bone dry. She is trapped in a web of duty and obligation, married to a man she once loved and no longer even knows. When her son died, a piece of Olivia died too.Accidentally, on the night of a bomb threat, they meet in Paris, at the Ritz. Their totally different lives converge for one magical moment in the Place Vendôme, as Olivia carefully, silently, steps out of her life and walks away. As the two strangers meet, their lives become briefly enmeshed. In a café in Montmartre, their hearts are laid bare. Peter, once so sure of his path, so certain of his marriage and success, but suddenly faced with his professional future in jeopardy. Olivia, no longer sure of anything except that she can't go on anymore.When Olivia disappears, only Peter suspects that it may not be foul play. And if he finds her again, where will they go from there? Five days in Paris is all they have. They go back to their separate lives, but nothing is the same. At home again, they both must pursue their lives, despite challenges, compromise, and betrayal. Everything they believe is put on the line, until they each realize they must stand fast against compromise and face life's challenges head-on.Read more",Dell Reprint edition ,1997,English,304,"https://images-na.ssl-images-amazon.com/images/I/41zUUIx6jRL._SY291_BO1,204,203,200_QL40_FMwebp_.jpg"
0446672211,Where the Heart Is,Billie Letts,Genre Fiction,Literature & Fiction,"Talk about unlucky sevens. An hour ago, seventeen-year-old, seven months pregnant Novalee Nation was heading for California with her boyfriend. Now she finds herself stranded at a Wal-Mart in Sequoyah, Oklahoma, with just $7.77 in change. But Novalee is about to discover hidden treasures in this small Southwest town--a group of down-to-earth, deeply caring people willing to help a homeless, jobless girl living secretly in a Wal-Mart. From Bible-thumping blue-haired Sister Thelma Husband to eccentric librarian Forney Hull who loves Novalee more than she loves herself, they are about to take her--and you, too--on a moving, funny, and unforgettable journey to . . . Where the Heart Is.Read more",Warner Books 1st edition ,1998,English,376,"https://images-na.ssl-images-amazon.com/images/I/51P4CcC+vnL._SY344_BO1,204,203,200_.jpg"
0804106304,The Joy Luck Club,Amy Tan,Genre Fiction,Literature & Fiction,A story of first generation immigrants' relationships with their American-born childrenRead more,Ivy Books ,1990,English,352,"https://images-na.ssl-images-amazon.com/images/I/51q6+yuHmrL._SY344_BO1,204,203,200_.jpg"
0316782505,The Weight of Water,Anita Shreve,Genre Fiction,Literature & Fiction,"""I wonder this: If you take a woman and push her to the edge, how will she behave?"" The question is posed by Jean, a photographer, who arrives on Smuttynose Island, off the coast of New Hampshire, to research a century-old crime. As she immerses herself in the details of the case--an outburst of passion that resulted in the deaths of two women--Jean herself enters precarious emotional territory. The suspicion that her husband is having an affair burgeons into jealousy and distrust, and ultimately propels Jean to the verge of actions she had not known herself capable of--actions with horrific consequences. Everywhere hailed for its beauty and power, The Weight of Water takes us on an unforgettable journey through the furthest extremes of emotion.Read more","Little, Brown and Company Reprint edition ",2001,English,304,"https://images-na.ssl-images-amazon.com/images/I/41dqPgMGXIL._SY291_BO1,204,203,200_QL40_FMwebp_.jpg"
0684865742,'Tis: A Memoir,Frank McCourt,Arts & Literature,Biographies & Memoirs,"A #1New York Timesbestseller and the eagerly anticipated sequel to the Pulitzer Prize–winningAngela’s Ashes, this masterpiece from Frank McCourt tells of his American journey from impoverished immigrant to brilliant teacher and raconteur.Frank McCourt’s glorious childhood memoir,Angela’s Ashes,has been loved and celebrated by readers everywhere for its spirit, its wit and its profound humanity. A tale of redemption, in which storytelling itself is the source of salvation, it won the National Book Critics Circle Award, theLos Angeles TimesBook Award and the Pulitzer Prize. Rarely has a book so swiftly found its place on the literary landscape.And now we have’Tis,the story of Frank’s American journey from impoverished immigrant to brilliant teacher and raconteur. Frank lands in New York at age nineteen, in the company of a priest he meets on the boat. He gets a job at the Biltmore Hotel, where he immediately encounters the vivid hierarchies of this “classless country,” and then is drafted into the army and is sent to Germany to train dogs and type reports. It is Frank’s incomparable voice—his uncanny humor and his astonishing ear for dialogue—that renders these experiences spellbinding.When Frank returns to America in 1953, he works on the docks, always resisting what everyone tells him, that men and women who have dreamed and toiled for years to get to America should “stick to their own kind” once they arrive. Somehow, Frank knows that he should be getting an education, and though he left school at fourteen, he talks his way into New York University. There, he falls in love with the quintessential Yankee, long-legged and blonde, and tries to live his dream. But it is not until he starts to teach—and to write—that Frank finds his place in the world. The same vulnerable but invincible spirit that captured the hearts of readers inAngela’s Ashescomes of age.As Malcolm Jones said in hisNewsweekreview ofAngela’s Ashes,“It is only the best storyteller who can so beguile his readers that he leaves them wanting more when he is done...and McCourt proves himself one of the very best.” Frank McCourt's’Tisis one of the most eagerly awaited books of our time, and it is a masterpiece.Read more",Simon & Schuster First Thus edition ,2000,English,368,"https://images-na.ssl-images-amazon.com/images/I/51d2pIEALcL._SY291_BO1,204,203,200_QL40_FMwebp_.jpg"
0316788228,The Pilot's Wife,Anita Shreve,Genre Fiction,Literature & Fiction,"Anita Shreve's hauntingly beautiful #1 bestseller and Oprah's Book Club selection about tragedy, grief, betrayal, and the 'impossibility of knowing another person.'As a pilot's wife, Kathryn has learned to expect both intense exhilaration and long periods alone, but nothing has prepared her for a late-night knock that lets her know her husband has died in a crash.Until now, Kathryn Lyons's life has been peaceful if unextraordinary: a satisfying job teaching high school in the New England mill town of her childhood; a picture-perfect home by the ocean; a precocious, independent-minded fifteen-year-old daughter; and a happy marriage whose occasional dull passages she attributes to the unavoidable deadening of time.As Kathryn struggles with her grief, she descends into a maelstrom of publicity stirred up by the modern hunger for the details of tragedy. Even before the plane is located in waters off the Irish coast, the relentless scrutiny of her husband's life begins to bring a bizarre personal mystery into focus. Could there be any truth to the increasingly disturbing rumors that he had a secret life?Read more","Little, Brown and Company 1st printing/2nd Edition ",2001,English,320,"https://images-na.ssl-images-amazon.com/images/I/51km70Zu7pL._SY291_BO1,204,203,200_QL40_FMwebp_.jpg"
0440224624,The Loop,Nicholas Evans,Genre Fiction,Literature & Fiction,"Loop, The by Evans, NicholasRead more",Dell First Edition ,1999,English,560,"https://images-na.ssl-images-amazon.com/images/I/51ZRrxlCH9L._SY291_BO1,204,203,200_QL40_FMwebp_.jpg"
0446692638,"Along Came a Spider (Alex Cross, 1)",James Patterson,Thrillers & Suspense,"Mystery, Thriller & Suspense","Discover the classic thriller that launched the #1 detective series of the past twenty-five years, now one of PBS's ""100 Great American Reads""Alex Cross is a homicide detective with a Ph.D. in psychology. He works and lives in the ghettos of D. C. and looks like Muhammad Ali in his prime. He's a tough guy from a tough part of town who wears Harris Tweed jackets and likes to relax by banging out Gershwin tunes on his baby grand piano. But he also has two adorable kids of his own, and they are his own special vulnerabilities.Jezzie Flanagan is the first woman ever to hold the highly sensitive job as supervisor of the Secret Service in Washington. Blond, mysterious, seductive, she's got an outer shell that's as tough as it is beautiful. She rides her black BMW motorcycle at speeds of no less than 100 mph. What is she running from? What is her secret?Alex Cross and Jezzie Flanagan are about to have a forbidden love affair-at the worst possible time for both of them. Because Gary Soneji, who wants to commit the ""crime of the century,"" is playing at the top of his game. Soneji has outsmarted the FBI, the Secret Service, and the police. Who will be his next victim?Gary Soneji is every parent's worst nightmare. He has become Alex Cross's nightmare. And now, reader, he's about to become yours.Read more",Grand Central Publishing 7.2.2003 edition ,2003,English,464,"https://images-na.ssl-images-amazon.com/images/I/514R-LVCSiL._SY291_BO1,204,203,200_QL40_FMwebp_.jpg"
0440214041,The Pelican Brief,John Grisham,Action & Adventure,Literature & Fiction,"In suburban Georgetown a killer's Reeboks whisper  on the front floor of a posh home... In a seedy  D.C. porno house a patron is swiftly  garroted to death... The next day America learns  that two of its Supreme Court justices have been  assassinated. And in New Orleans, a young law  student prepares a legal brief... To Darby Shaw it was  no more than a legal shot in the dark, a brilliant  guess. To the Washington establishment it was  political dynamite. Suddenly Darby is witness to a  murder -- a murder intended for her. Going  underground, she finds there is only one person she can  trust -- an ambitious reporter after a newsbreak  hotter than Watergate -- to help her piece together the  deadly puzzle. Somewhere between the bayous of  Louisiana and the White House's inner sanctums, a  violent cover-up is being engineered. For somone has  read Darby's brief. Someone who will stop at  nothing to destroy the evidence of an unthinkable  crime.Read more",Island Reprint edition ,1993,English,436,"https://images-na.ssl-images-amazon.com/images/I/51IMCqCjhaL._SY291_BO1,204,203,200_QL40_FMwebp_.jpg"
0380710218,Post-mortem,Patricia D. Cornwell,Genre Fiction,Literature & Fiction,"Dr. Kay Scarpetta, chief medical examiner in Virginia City, is determined to unmask a serial killer who is leaving a trail of carnage throughout a terrified city, but as she struggles to find the key to unlock the mystery, she confronts unexpected sabotage. Reissue.""Read more",Avon Books 1st Avon Books edition ,1991,English,339,"https://images-na.ssl-images-amazon.com/images/I/71KANYRMH6L._SY291_BO1,204,203,200_QL40_FMwebp_.gif"
0142000205,Icy Sparks (Oprah's Book Club),Gwyn Hyman Rubio,Contemporary,Literature & Fiction,"ANew York TimesNotable Book and the March 2001 selection ofOprah's Book Club® !Icy Sparksis the sad, funny and transcendent tale of a young girl growing up in the mountains of Eastern Kentucky during the 1950’s.Gwyn Hyman Rubio’s beautifully written first novel revolves around Icy Sparks, an unforgettable heroine in the tradition of Scout inTo Kill a Mockingbirdor Will Treed inCold Sassy Tree. At the age of ten, Icy, a bright, curious child orphaned as a baby but raised by adoring grandparents, begins to have strange experiences. Try as she might, her ""secrets""—verbal croaks, groans, and physical spasms—keep afflicting her. As an adult, she will find out she has Tourette’s Syndrome, a rare neurological disorder, but for years her behavior is the source of mystery, confusion, and deep humiliation.Narrated by a grown up Icy, the book chronicles a difficult, but ultimately hilarious and heartwarming journey, from her first spasms to her self-acceptance as a young woman. Curious about life beyond the hills, talented, and energetic, Icy learns to cut through all barriers—physical, mental, and spiritual—in order to find community and acceptance.Along her journey, Icy faces the jeers of her classmates as well as the malevolence of her often-ignorant teachers—including Mrs. Stilton, one of the most evil fourth grade teachers ever created by a writer. Called willful by her teachers and ""Frog Child"" by her schoolmates, she is exiled from the schoolroom and sent to a children’s asylum where it is hoped that the roots of her mysterious behavior can be discovered. Here Icy learns about difference—her own and those who are even more scarred than she. Yet, it isn’t until Icy returns home that she really begins to flower, especially through her friendship with the eccentric and obese Miss Emily, who knows first-hand how it feels to be an outcast in this tightly knit Appalachian community. Under Miss Emily’s tutelage, Icy learns about life’s struggles and rewards, survives her first comical and heartbreaking misadventure with romance, discovers the healing power of her voice when she sings, and ultimately—takes her first steps back into the world.Gwyn Hyman Rubio’s Icy Sparks is a fresh, original, and completely redeeming novel about learning to overcome others’ ignorance and celebrate the differences that make each of us unique.Read more",Penguin Books ,2001,English,308,"https://images-na.ssl-images-amazon.com/images/I/51l7k1h4HGL._SY291_BO1,204,203,200_QL40_FMwebp_.jpg"
0316182540,White Oleander: A Novel,Janet Fitch,Literary,Literature & Fiction,"When Astrid's mother, a beautiful, headstrong poet, murders a former lover and is imprisoned for life, Astrid becomes one of the thousands of foster children in Los Angeles. As she navigates this new reality, Astrid finds strength in her unshakable certainty of her own worth and her unfettered sense of the absurd.Read more","Little, Brown and Company 0 edition ",2001,English,496,"https://images-na.ssl-images-amazon.com/images/I/51kOK5XhytL._SY291_BO1,204,203,200_QL40_FMwebp_.jpg"
0312983867,"Hard Eight (Stephanie Plum, No. 8) (Stephanie Plum Novels)",Janet Evanovich,Action & Adventure,Literature & Fiction,"The #1 bestselling phenomenon continues in the eighth Stephanie Plum novel. The stakes get higher, the crimes get nastier, the chases get faster, and the men get hotter.This time Stephanie, Morelli, Ranger. Lula, Valerie, and Grandma Mazur are strapped in for the ride of their lives. Stephanie is hired to find a missing child. But things aren't always as they seem and Stephanie must determine if she's working for the right side of the law. Plus, there's the Morelli question: can a Jersey girl keep her head on straight when more than just bullets are aimed for her heart? And with the Plum and Morelli relationship looking rocky, is it time for Ranger to move in for the kill? Janet Evanovich's latest thriller proves thatHard Eightwill never be enough.Read more",St. Martin's Press ,2003,English,352,"https://images-na.ssl-images-amazon.com/images/I/51BAXvJFfDL._SY291_BO1,204,203,200_QL40_FMwebp_.jpg"
0805211152,The Testament: A novel,Elie Wiesel,Literature & Fiction,Christian Books & Bibles,"On August 12, 1952, Russia's greatest Jewish writers were secretly executed by Stalin. In this remarkable blend of history and imagination, Paltiel Kossover meets the same fate but, unlike his real-life counterparts, he is permitted to leave a written testament. From a Jewish boyhood in pre-revolutionary Russia, Paltiel traveled down a road that embraced Communism, only to return to Russia and discover a Communist Party that had become his mortal enemy. Two decades later, Paltiel's son, Grisha, reads this precious record of his father's life and finds that it illuminates the shadowed planes of his own.Passionate and fierce, this story of a father's legacy to his son revisits some of the most dramatic events of our century, and confirms yet again Elie Wiesel's stature as ""a writer of the highest moral imagination"" (San Francisco Chronicle).Read more",Knopf Doubleday Publishing Group Reprint edition ,1999,English,352,"https://images-na.ssl-images-amazon.com/images/I/51DMK42vZrL._SY291_BO1,204,203,200_QL40_FMwebp_.jpg"
0671001795,"Two for the Dough (Stephanie Plum, No. 2) (Stephanie Plum Novels)",Janet Evanovich,Mystery,"Mystery, Thriller & Suspense","Bounty hunter Stephanie Plum is packing a whole lot of attitude -- not to mention stun guns, defense sprays, and a .38 Smith & Wesson. She's on the trail of Kenny Mancuso, from working-class Trenton, New Jersey, who has just shot his best friend. Fresh out of the army and suspiciously wealthy, Mancuso's also distantly related to Joe Morelli, a vice cop with questionable ethics, a libido in permanent overdrive, and a habit of horning in on Stephanie's investigations. Aided by her tough bounty-hunting pal, Ranger, and her funeral-hopping Grandma Mazur, Stephanie's soon staggering knee-deep in corpses, trying to shake Morelli...and stirring up a very nasty enemy.Read more",Pocket Books ,1996,English,336,"https://images-na.ssl-images-amazon.com/images/I/51VSqTw7haL._SY291_BO1,204,203,200_QL40_FMwebp_.jpg"
0312971346,"High Five (Stephanie Plum, No. 5) (Stephanie Plum Novels)",Janet Evanovich,Humor & Satire,Literature & Fiction,"Out of bail skippers and rent money, Stephanie Plum throws caution to the wind and follows in the entrepreneurial bootsteps of Super Bounty Hunter, Ranger, engaging in morally correct and marginally legal enterprises. So, a scumball blows himself to smithereens on her first day of policing a crack house and the sheik she was chauffeuring stole the limo. But hey, nobody's perfect! Anyway, Stephanie has other things on her mind. Her mother wants her to find Uncle Fred who's missing after arguing with his garbage company; homicidal rapist Benito Ramirez is back, quoting scripture and stalking Stephanie; vice cop Joe Morelli has a box of condoms with Stephanie's name on it; and Stephanie's afraid Ranger has his finger on her trigger. The whole gang's here for mirth and mayhem in Janet Evanovich'sHigh Five. Read at your own risk in public places.Read more",St. Martin's Paperbacks ,2000,English,352,"https://images-na.ssl-images-amazon.com/images/I/51A2tFpdsBL._SY291_BO1,204,203,200_QL40_FMwebp_.jpg"
0312990456,"One for the Money (Stephanie Plum, No. 1)",Janet Evanovich,Mystery,"Mystery, Thriller & Suspense","ONE FINE MESSWelcome to Trenton, New Jersey, home to wiseguys, average Joes, and Stephanie Plum, who sports a big attitude and even bigger money problems (since losing her job as a lingerie buyer for a department store). Stephanie needs cash-fast-but times are tough, and soon she's forced to turn to the last resort of the truly desperate: family...ONE FALSE MOVEStephanie lands a gig at her sleazy cousin Vinnie's bail bonding company. She's got no experience. But that doesn't matter. As does the fact that the bail jumper in question is local vice cop Joe Morelli. From the time he first looked up her dress to the time he first got into her pants, to the time Steph hit him with her father's Buick, M-o-r-e-l-l-i has spelled t-r-o-u-b-l-e. And now the hot guy is in hot water-wanted for murder...ONE FOR THE MONEYAbject poverty is a great motivator for learning new skills, but being trained in the school of hard knocks by people like psycho prizefighter Benito Ramirez isn't. Still, if Stephanie can nab Morelli in a week, she'll make a cool ten grand. All she has to do is become an expert bounty hunter overnight-and keep herself from getting killed before she gets her man...Read more",St. Martin's Press Revised ed. edition ,2003,English,352,"https://images-na.ssl-images-amazon.com/images/I/41RHWXxVldL._SY291_BO1,204,203,200_QL40_FMwebp_.jpg"
0316168815,The Lovely Bones,Alice Sebold,Genre Fiction,Literature & Fiction,"""My name was Salmon, like the fish; first name, Susie. I was fourteen when I was murdered on December 6, 1973.""So begins the story of Susie Salmon, who is adjusting to her new home in heaven, a place that is not at all what she expected, even as she is watching life on earth continue without her -- her friends trading rumors about her disappearance, her killer trying to cover his tracks, her grief-stricken family unraveling. Out of unspeakable tragedy and loss,The Lovely Bonessucceeds, miraculously, in building a tale filled with hope, humor, suspense, even joy.Read more",Back Bay Books Reprint edition ,2004,English,368,"https://images-na.ssl-images-amazon.com/images/I/41-3yUnI7rL._SY291_BO1,204,203,200_QL40_FMwebp_.jpg"
044022165X,The Rainmaker,John Grisham,Thrillers & Suspense,"Mystery, Thriller & Suspense","It's summer in Memphis.  The sweat is sticking to Rudy Baylor's shirt and creditors are nipping at his heels.  Once he had aspirations of breezing through law school and punching his ticket to the good life.  Now he doesn't have a job or a prayer...except for one: an insurance dispute that leaves a family devastated and opens the door for a lawsuit, if Rudy can find a way to file it.By the time Rudy gets to court, a heavyweight corporate defense team is there to meet him. And suddenly he's in over his head, plunged into a nightmare of lies and legal maneuverings.  A case that started small is exploding into a thunderous million-dollar war of nerves, skill and outright violence--a fight that could cost one young lawyer his life, or turn him into the biggest rainmaker in the land....Read more",Dell Publishing Company Later Printing Used edition ,1996,English,598,"https://images-na.ssl-images-amazon.com/images/I/41bBn3kW5tL._SY291_BO1,204,203,200_QL40_FMwebp_.jpg"
0767903862,In a Sunburned Country,Bill Bryson,"Writing, Research & Publishing Guides",Reference,"Every time Bill Bryson walks out the door, memorable travel literature threatens to break out. This time in Australia.His previous excursion along the Appalachian Trail resulted in the sublime national bestsellerA Walk in the Woods.In A Sunburned Countryis his report on what he found in an entirely different place: Australia, the country that doubles as a continent, and a place with the friendliest inhabitants, the hottest, driest weather, and the most peculiar and lethal wildlife to be found on the planet. The result is a deliciously funny, fact-filled, and adventurous performance by a writer who combines humor, wonder, and unflagging curiousity.Despite the fact that Australia harbors more things that can kill you in extremely nasty ways than anywhere else, including sharks, crocodiles, snakes, even riptides and deserts, Bill Bryson adores the place, and he takes his readers on a rollicking ride far beyond that beaten tourist path. Wherever he goes he finds Australians who are cheerful, extroverted, and unfailingly obliging, and these beaming products of land with clean, safe cities, cold beer, and constant sunshine fill the pages of this wonderful book.Australia is an immense and fortunate land, and it has found in Bill Bryson its perfect guide.Read more",Crown ,2001,English,352,"https://images-na.ssl-images-amazon.com/images/I/511w+m1L4fL._SY344_BO1,204,203,200_.jpg"
