isbn,title,author,category,sub_category,description,publisher,year_of_publication,language,num_pages,img_link
0515128554,"Heart of the Sea (Irish Trilogy, Book 3)",Nora Roberts,Genre Fiction,Literature & Fiction,"BOOK THREE OF THE GALLAGHERS OF ARDMORE TRILOGYWalk with #1New York Timesbestselling author Nora Roberts in the shadow of an ancient tower and hear a story of dreams fulfilled and wishes come true…Darcy Gallagher has always believed in the pull of fate, the magic of legend…and the importance of money. She longs to find a rich man who will sweep her away—into a world filled with glamour and adventure, and the exotic life that is her destiny…A wealthy businessman with Irish blood, Trevor Magee has come to Ardmore to build a theater—and to uncover the secrets hidden in his family’s past. He thought he had given up on love long ago, but Darcy Gallagher tempts him like no woman ever has. She’s gorgeous and intelligent, and she knows what she wants—and he’s more than willing to give it to her. But as their mutual attraction flares into passion, they look into their hearts—and find out what happens when you truly believe.Don't miss the other books in the Gallaghers of Ardmore trilogyJewels of the SunTears of the MoonRead more",Berkley 1st edition ,2000,English,400,"https://images-na.ssl-images-amazon.com/images/I/51EVpsrhW3L._SY291_BO1,204,203,200_QL40_FMwebp_.jpg"
0515136530,Key of Valor,Nora Roberts,Genre Fiction,Literature & Fiction,"A woman’s quest for courage opens her heart to love in the third Key Trilogy novel from #1New York Timesbestselling author Nora Roberts.Growing up, Zoe McCourt did not have an easy life—some might call it “disadvantaged.” A hairstylist from a West Virginia trailer park, she ended up in beautiful Pleasant Valley, Pennsylvania, by sheer determination. How she ended up on a quest for a key to unlock the soul of a warrior demigoddess is another story…Invited to an imposing estate overlooking the town, she met Malory Price and Dana Steele. Each woman was at a crossroads in her life, each facing an uncertain future. And a mysterious couple offered them the chance of a lifetime: a million dollars each if they could free the trapped souls of three mythological sisters—an artist, a bard, and a warrior.Malory and Dana had to reach deep inside themselves to find their keys—and not without paying a price. Now, it has become Zoe’s quest. As a single mother, she has more to risk, more to lose. But her courage in the face of overwhelming odds cannot be underestimated. A nurturer to her son, a defender of her friends, she must confront dark forces amassed against her to make all of their dreams come true…Don’t miss the other books in the Key TrilogyKey of LightKey of KnowledgeRead more",Berkley 1st Edition ,2003,English,352,"https://images-na.ssl-images-amazon.com/images/I/51VDaP+WkXL._SY344_BO1,204,203,200_.jpg"
0441000916,"The Laughing Corpse (Anita Blake, Vampire Hunter)",Laurell K. Hamilton,Genre Fiction,Literature & Fiction,"Anita Blake takes on a rogue fellow animator who is using human sacrifices to raise the dead and discovers that her only hope of survival lies in depending upon the feared Jean Claude, Master Vampire of the City.Read more",Ace ,1994,English,304,"https://images-na.ssl-images-amazon.com/images/I/41WAFNPJENL._SY291_BO1,204,203,200_QL40_FMwebp_.jpg"
051513449X,"Guilty Pleasures (Anita Blake, Vampire Hunter: Book 1)",Laurell K. Hamilton,Genre Fiction,Literature & Fiction,"Meet Anita Blake, Vampire Hunter, in the first novel in the #1New York Timesbestselling series that “blends the genres of romance, horror and adventure with stunning panache”(Diana Gabaldon).Laurell K. Hamilton’s bestselling series has captured readers’ wildest imaginations and addicted them to a seductive world where supernatural hungers collide with the desires of the human heart, starring a heroine like no other...Anita Blake is small, dark, and dangerous. Her turf is the city of St. Louis. Her job: re-animating the dead and killing the undead who take things too far. But when the city’s most powerful vampire asks her to solve a series of vicious slayings, Anita must confront her greatest fear—her undeniable attraction to master vampire Jean-Claude, one of the creatures she is sworn to destroy...“WhatThe Da Vinci Codedid for the religious thriller, the Anita Blake series has done for the vampire novel.”—USA TodayRead more",Berkley ,2002,English,272,"https://images-na.ssl-images-amazon.com/images/I/51Cewyucx0L._SY291_BO1,204,203,200_QL40_FMwebp_.jpg"
0515135062,Three Fates,Nora Roberts,Women's Fiction,Literature & Fiction,"From #1New York Timesbestselling author Nora Roberts comes an unforgettable tale of luck and love in which the fortunes of three siblings depend on a simple twist of fate.When theRMS Lusitaniasank in 1915, one survivor became a changed man, giving up his life as a petty thief. But the man still kept the small silver statue he lifted, saving it as a reminder of his past and a family heirloom for future generations. A century later, that priceless heirloom—one of a long-separated set of three—has been stolen again.Malachi, Gideon, and Rebecca Sullivan are determined to recover their great-great-grandfather’s treasure, reunite the Three Fates, and make their fortune. Their quest will take them from their home in Ireland to Helsinki, Prague, and New York, where they will meet a brilliant scholar who will aid them in their hunt—and an ambitious woman who will stop at nothing to acquire the Fates....Read more",Berkley Reprinted edition ,2003,English,496,"https://images-na.ssl-images-amazon.com/images/I/416JWlL6ahL._SY291_BO1,204,203,200_QL40_FMwebp_.jpg"
0312974256,Welcome to Temptation,Jennifer Crusie,Erotica,Literature & Fiction,"Turn left at small town secrets...Sophie Dempsey is content living a quiet life filming wedding videos until an assignment brings her to Temptation, Ohio. From the moment she drive into town, she gets a bad feeling; Sophie is from the wrong side of the tracks and everything in Temptation is a little too right. And when she has a run-in with the town's unnervingly sexy mayor, Phineas Tucker, making a little movie turns out to be more than a little dangerous.Yield to oncoming desire...All Sophie wants to do is film the video and head home. All Phin wants to do is play pool with the police chief and keep things peaceful. They both get more than they bargained for when Sophie's video causes an uproar and the proper citizens of Temptation set out to shut them down.Welcome to temptation...As event spiral out of control, Sophie and Phin find themselves caught in a web of gossip, blackmail, adultery, murder, and really excellent sex. All hell breaks loose in Temptation as Sophie and Phin fall deeper and deeper in trouble...and in love.Read more",St. Martin's Paperbacks ,2001,English,416,"https://images-na.ssl-images-amazon.com/images/I/4174TlBesIL._SY291_BO1,204,203,200_QL40_FMwebp_.jpg"
0671034022,Mercy,Julie Garwood,Thrillers & Suspense,"Mystery, Thriller & Suspense","From the #1New York Timesbestselling author ofHeartbreakercomes a thrilling novel of passion and obsession featuring attorney Theo Buchanan.Like his FBI agent brother Nick, Theo Buchanan is devoted to his crime-fighting career. Unlike his brother, he works the other side of the desk as an esteemed Justice Department attorney and rarely sees on-the-field action—until he comes to the aid of Dr. Michelle Renard, a beautiful and brilliant surgeon in Bowen, Louisiana, who recently saved his own life. Michelle’s medical clinic has been vandalized, and the investigation uncovers a deadly ring of criminals bent on preserving their secrecy at any cost.They call themselves the Sowing Club: four white-collar professionals whose sophisticated crimes have amassed millions of dollars in a Cayman Islands bank account. The group is bound by a pact to leave the cash untouched until they accumulate a certain amount, but their leader, John, is distracted by and nearly bankrupt from his wife's grave illness. Knowing what must be done, John turns to his three friends to mercy-kill his wife, but the line between mercy and murder quickly vanishes....As the relentless and cold-blooded Sowing Club sets out to silence Michelle, the one person who has information that could destroy them, Theo confronts the lies, greed, and evil that bind the lethal foursome—and risks more than he ever has before. Michelle saved his life...now can he save hers?Read more",Pocket Books Reprint edition ,2002,English,496,"https://images-na.ssl-images-amazon.com/images/I/514RPEzj5tL._SY291_BO1,204,203,200_QL40_FMwebp_.jpg"
059035342X,Harry Potter and the Sorcerer's Stone,J.K. Rowling,Growing Up & Facts of Life,Children's Books,"Harry Potter has no idea how famous he is. That's because he's being raised by his miserable aunt and uncle who are terrified Harry will learn that he's really a wizard, just as his parents were. But everything changes when Harry is summoned to attend an infamous school for wizards, and he begins to discover some clues about his illustrious birthright. From the surprising way he is greeted by a lovable giant, to the unique curriculum and colorful faculty at his unusual school, Harry finds himself drawn deep inside a mystical world he never knew existed and closer to his own noble destiny.Read more","Scholastic 1st Scholastic Td Ppbk Print., Sept.1999 edition ",1999,English,309,"https://images-na.ssl-images-amazon.com/images/I/51HSkTKlauL._SY291_BO1,204,203,200_QL40_FMwebp_.jpg"
0445406518,Crocodile on the Sandbank (Amelia Peabody),Elizabeth Peters,Action & Adventure,Literature & Fiction,"Meet Egyptologist Amelia Peabody in the first mystery in the Victorian-era set,New York Timesbestselling ""sparkling series"" (Marilyn Stasio,New York Times Book Review).""If Indiana Jones were female, a wife, and a mother who lived in Victorian times, he would be Amelia Peabody Emerson.""--Publishers WeeklyAmelia Peabody, that indomitable product of the Victorian age, embarks on her debut Egyptian adventure armed with unshakable self-confidence, a journal to record her thoughts, and, of course, a sturdy umbrella. On her way to Cairo, Amelia rescues young Evelyn Barton-Forbes, who has been abandoned by her scoundrel lover. Together the two women sail up the Nile to an archeological site run by the Emerson brothers-the irascible but dashing Radcliffe and the amiable Walter. Soon their little party is increased by one-one mummy that is, and a singularly lively example of the species.Strange visitations, suspicious accidents, and a botched kidnapping convince Amelia that there is a plot afoot to harm Evelyn. Now Amelia finds herself up against an unknown enemy-and perilous forces that threaten to make her first Egyptian trip also her last . . .Praise for Elizabeth Peters andCrocodile on the Sandbank""A writer so popular that the public library has to keep her books under lock and key."" -Washington Post Book World""Grand views of Egyptian antiquities . . . a sparkling series."" -Marilyn Stasio,New York Times Book ReviewRead more",Warner Books ,1988,English,262,"https://images-na.ssl-images-amazon.com/images/I/51GGZaGUKmL._SY291_BO1,204,203,200_QL40_FMwebp_.jpg"
0515120618,Montana Sky,Nora Roberts,Women's Fiction,Literature & Fiction,"#1New York Timesbestselling author Nora Roberts surpasses herself once again, with a novel as sweeping and extraordinary as the Montana sky itself…When Jack Mercy died, he left behind a ranch worth nearly twenty million dollars. Now his three daughters—each born of a different mother, and each unknown by the others—are gathered to hear the reading of the will. But the women are shocked to learn that before any of them can inherit, they must live together on the ranch for one year.For Tess, a screenwriter who just wants to collect her cash and get back to Hollywood, it’s a nightmare. For Lily, on the run from her abusive ex-husband, it’s a refuge. And for Willa—who grew up on the ranch—it’s an intrusion into her rightful home.They are sisters...and strangers. Now they face a challenge: to put their bitterness aside and live like a family. To protect each other from danger—and unite against an enemy who threatens to destroy them all...Read more",Berkley ,1997,English,496,"https://images-na.ssl-images-amazon.com/images/I/41mBIwDcJYL._SY291_BO1,204,203,200_QL40_FMwebp_.jpg"
0553582127,The Search (Eve Duncan),Iris Johansen,Mystery,"Mystery, Thriller & Suspense","NEW YORK TIMESBESTSELLER • He strikes without warning. He kills without mercy. He's only just begun.As part of an elite K-9 search and rescue team, Sarah Patrick and her golden retriever, Monty, have a gift for finding what no one else can. But their latest assignment is not like the others. This time Sarah is being forced to take part in a deadly mission . . . by a man who knows enough about her past to ensure her cooperation.Billionaire John Logan's top-secret venture has been sabotaged, its facilities destroyed, and its handpicked staff massacred. The sole survivor is being held for ransom. Logan knows that the only way to save the man—and the secrets he holds—is to find him as soon as possible.Sarah is furious when she is strong-armed into joining Logan on his search. And once she takes the perilous assignment, not even Logan's promises that she and Monty will be safe may be enough to protect them. Because a killer is devising a sadistic vengeance . . . and he may soon find use for Sarah.Read more",Bantam Books Reprint edition ,2001,English,323,"https://images-na.ssl-images-amazon.com/images/I/51b1ZscyATL._SY291_BO1,204,203,200_QL40_FMwebp_.jpg"
0515132187,The Villa,Nora Roberts,Women's Fiction,Literature & Fiction,"#1New York Timesbestselling author Nora Roberts exposes a proud family’s deadly secrets in this passionate tale of two Napa Valley rivals...PR executive Sophia Giambelli loves her job and has never worried about competition. For three generations, her family’s wines have been world-renowned for their quality. But things are about to change at Villa Giambelli. Tereza, the matriarch, has announced a merger with the MacMillan family’s winery—and Sophia will be assuming a new role.As a savvy businesswoman, Sophia knows she must be prepared for anything...but she isn’t prepared for Tyler MacMillan. They’ve been ordered to work together very closely, to facilitate the merger. Sophia must teach Ty the finer points of marketing—and Ty, in turn, shows her how to get down and dirty, to use the sun, rain, and earth to coax the sweetest grapes from the vineyard.As they toil together, both in and out of the fields, Sophia is torn between a powerful attraction and a professional rivalry. At the end of the season, the course of the company’s future—and the legacy of the villa—may take an entirely new direction. And when acts of sabotage threaten both the family business and the family itself, Sophia’s quest will be not only for dominance, but also for survival.Read more",Berkley Reissue edition ,2002,English,496,"https://images-na.ssl-images-amazon.com/images/I/41Dfo0pia0L._SY291_BO1,204,203,200_QL40_FMwebp_.jpg"
0373483503,Macgregor Brides (Macgregors),Nora Roberts,Contemporary,Romance,The illustrious MacGregor clan's irresistible patriarch--and relentless matchmaker--is determined to have his three lovely granddaughters engaged by Christmas and has handpicked three unsuspecting gentlemen as their prospective mates. Original.Read more,Silhouette ,1997,English,377,"https://images-na.ssl-images-amazon.com/images/I/5129EWP9NXL._SY291_BO1,204,203,200_QL40_FMwebp_.jpg"
0515132020,Heaven and Earth (Three Sisters Island Trilogy),Nora Roberts,Genre Fiction,Literature & Fiction,"In the second book in her Three Sisters Island Trilogy, #1New York Timesbestselling author Nora Roberts returns to the haunting shores of New England—and to the lives of three passionate, powerful women…Ripley Todd's job as a sheriff’s deputy keeps her busy and happy, and she has no trouble finding men when she wants them—which, lately, isn’t all that often. She’s perfectly content, except for one thing: she has special powers that both frighten and confuse her.Distraction soon arrives in the handsome form of MacAllister Booke—a researcher who’s come to investigate the rumors of witchcraft that haunt Three Sisters Island. Right from the start, he knows there’s something extraordinary about Ripley Todd. Fascinated by her struggle with her amazing abilities, he becomes determined to help her accept who she is—and find the courage to open her heart.But before Ripley and Mac can dream of what lies in the future, they must confront the pain of the past. For Three Sisters shelters centuries of secrets—and a legacy of danger that plagues them still…Don't miss the other books in the Three Sisters Island TrilogyDance Upon the AirFace the FireRead more",Berkley Reissue edition ,2001,English,368,"https://images-na.ssl-images-amazon.com/images/I/51-UMrVFV3L._SY291_BO1,204,203,200_QL40_FMwebp_.jpg"
014025448X,At Home in Mitford,Jan Karon,Literature & Fiction,Christian Books & Bibles,"The first novel in #1New York Timesbestselling author Jan Karon’s beloved series set in America’s favorite small town: Mitford.It's easy to feel at home in Mitford. In these high, green hills, the air is pure, the village is charming, and the people are generally lovable. Yet, Father Tim, the bachelor rector, wants something more. Enter a dog the size of a sofa who moves in and won't go away. Add an attractive neighbor who begins wearing a path through the hedge. Now, stir in a lovable but unloved boy, a mystifying jewel theft, and a secret that's sixty years old. Suddenly, Father Tim gets more than he bargained for. And readers get a rich comedy about ordinary people and their ordinary lives.Read more",Penguin Books ,1996,English,446,"https://images-na.ssl-images-amazon.com/images/I/51JZqP0n5dL._SY291_BO1,204,203,200_QL40_FMwebp_.jpg"
0440221595,The Glass Lake,Maeve Binchy,Genre Fiction,Literature & Fiction,"Night after night the beautiful woman walked beside the serene waters of Lough Glass. Until the day she disappeared, leaving only a boat drifting upside down on the unfathomable lake that gave the town its name. Ravishing Helen McMahon, the Dubliner with film-star looks and unfulfilled dreams, never belonged in Lough Glass, not the way her genial pharmacist-husband Martin belonged, or their spirited daughter Kit. Suddenly, she is gone and Kit is haunted by the memory of her mother, seen through a window, alone at the kitchen table, tears streaming down her face. Now Kit, too, has secrets: of the night she discovered a letter on Martin’s pillow and burned it, unopened. The night her mother was lost. The night everything changed forever…Read more",Dell ,1996,English,768,"https://images-na.ssl-images-amazon.com/images/I/51uUd-OCPRL._SY291_BO1,204,203,200_QL40_FMwebp_.jpg"
0449005615,Seabiscuit: An American Legend,Laura Hillenbrand,Individual Sports,Sports & Outdoors,"#1NEW YORK TIMESBESTSELLER • From the author of the runaway phenomenonUnbrokencomes a universal underdog story about the horse who came out of nowhere to become a legend.Seabiscuit was one of the most electrifying and popular attractions in sports history and the single biggest newsmaker in the world in 1938, receiving more coverage than FDR, Hitler, or Mussolini. But his success was a surprise to the racing establishment, which had written off the crooked-legged racehorse with the sad tail. Three men changed Seabiscuit’s fortunes:Charles Howard was a onetime bicycle repairman who introduced the automobile to the western United States and became an overnight millionaire. When he needed a trainer for his new racehorses, he hired Tom Smith, a mysterious mustang breaker from the Colorado plains. Smith urged Howard to buy Seabiscuit for a bargain-basement price, then hired as his jockey Red Pollard, a failed boxer who was blind in one eye, half-crippled, and prone to quoting passages from Ralph Waldo Emerson. Over four years, these unlikely partners survived a phenomenal run of bad fortune, conspiracy, and severe injury to transform Seabiscuit from a neurotic, pathologically indolent also-ran into an American sports icon.Praise forSeabiscuit“Fascinating . . . Vivid . . . A first-rate piece of storytelling, leaving us not only with a vivid portrait of a horse but a fascinating slice of American history as well.”—The New York Times“Engrossing . . . Fast-moving . . . More than just a horse’s tale, because the humans who owned, trained, and rode Seabiscuit are equally fascinating. . . . [Laura Hillenbrand] shows an extraordinary talent for describing a horse race so vividly that the reader feels like the rider.”—Sports Illustrated“REMARKABLE . . . MEMORABLE . . . JUST AS COMPELLING TODAY AS IT WAS IN 1938.”—The Washington PostRead more",Ballantine Books ,2002,English,399,"https://images-na.ssl-images-amazon.com/images/I/51xo-oTknUL._SY291_BO1,204,203,200_QL40_FMwebp_.jpg"
1558745718,"Chicken Soup for the Pet Lover's Soul: Stories About Pets as Teachers, Healers, Heroes and Friends (Chicken Soup for the Soul)",Jack Canfield,Pets & Animal Care,"Crafts, Hobbies & Home","Animals bring out the goodness, humanity and optimism in people and speak directly to our souls. This joyous, inspiring and entertaining Chicken Soup collection relates the unique bonds between animals and the people whose lives they've changed. Such as the dolphins who helped a paralyzed woman heal when doctors offered little hope; the dog who brought life into a failing marriage; the kitten who helped a mother mourn; and the flying squirrel who taught a man the power of laughter.Packed with celebrity pet-lore, Chicken Soup for the Soul relates the unconditional love, loyalty, courage and companionship that only animals possess. Just like our furry, feathered and four-legged friends, this enchanting book will bring a smile to any pet lover's face ... and it's housebroken!Read more",Health Communications Inc First Scholastic Printing edition ,1998,English,352,"https://images-na.ssl-images-amazon.com/images/I/51x5jnz9b2L._SY291_BO1,204,203,200_QL40_FMwebp_.jpg"
0446611867,A Bend in the Road,Nicholas Sparks,Genre Fiction,Literature & Fiction,"Fall in love with this small-town love story about a widower sheriff and a divorced schoolteacher who are searching for second chances -- only to be threatened by long-held secrets of the past.Miles Ryan's life seemed to end the day his wife was killed in a hit-and-run accident two years ago. As deputy sheriff of New Bern, North Carolina, he not only grieves for her and worries about their young son Jonah but longs to bring the unknown driver to justice. Then Miles meets Sarah Andrews, Jonah's second-grade teacher. A young woman recovering from a difficult divorce, Sarah moved to New Bern hoping to start over. Tentatively, Miles and Sarah reach out to each other...soon they are falling in love. But what neither realizes is that they are also bound together by a shocking secret, one that will force them to reexamine everything they believe in-including their love.Read more",Grand Central Publishing Reprint edition ,2002,English,368,"https://images-na.ssl-images-amazon.com/images/I/51h+6ouVb2L._SY344_BO1,204,203,200_.jpg"
0060391626,I Know This Much Is True,Wally Lamb,Genre Fiction,Literature & Fiction,"#1New York TimesBestseller and Oprah Book Club selection""Thoughtful . . . heart-wrenching . . . . An exercise in soul-baring storytelling—with the soul belonging to 20th-century America itself. It's hard to read and to stop reading, and impossible to forget.""  —USA TodayDominick Birdsey, a forty-year-old housepainter living in Three Rivers, Connecticut, finds his subdued life greatly disturbed when his identical twin brother Thomas, a paranoid schizophrenic, commits a shocking act of self-mutilation. Dominick is forced to care for his brother as well as confront dark secrets and pain he has buried deep within himself—a journey of the soul that takes him beyond his blue-collar New England town to Sicily’s Mount Etna, the birthplace of his grandfather and namesake. Coming to terms with his life and lineage, Dominick struggles to find forgiveness and finally rebuild himself beyond the haunted shadow of his troubled twin.I Know This Much Is True is a masterfully told story of alienation and connection, power and abuse, devastation and renewal—an unforgettable masterpiece.Read more",Regan Books 1st edition ,1998,English,901,"https://images-na.ssl-images-amazon.com/images/I/41oDkw9CDUL._SY291_BO1,204,203,200_QL40_FMwebp_.jpg"
